title,issue_number,link,labels,Branded variable name,CF standard name,CMIP6 Differences,Cell measures,Cell methods,Comment,Dimensions,Frequency,Long name,Modeling realm,Positive,Processing notes,Units,Variable status,Expression HadGEM3-GC31,Expression HadGEM3-GC5,Expression UKESM1,Expression UKESM1-3,Model units
Variable aerosol.mon.scldncl_tavg-u-hxy-scl (Emon.scldncl),1014,https://github.com/UKNCSP/CDDS-CMIP7-mappings/issues/1014,mon aerosol,scldncl_tavg-u-hxy-scl,number_concentration_of_stratiform_cloud_liquid_water_particles_at_stratiform_liquid_water_cloud_top,Not present,area: areacella,area: time: mean,Cloud Droplet Number Concentration of Stratiform Cloud Tops,longitude latitude time,mon,Cloud Droplet Number Concentration of Stratiform Cloud Tops,aerosol,,,m-3,New,,,,,
Variable aerosol.mon.reffsclwtop_tavg-u-hxy-scl (Emon.reffsclwtop),993,https://github.com/UKNCSP/CDDS-CMIP7-mappings/issues/993,mon aerosol,reffsclwtop_tavg-u-hxy-scl,effective_radius_of_stratiform_cloud_liquid_water_particles_at_stratiform_liquid_water_cloud_top,Not present,area: areacella,area: time: mean where stratiform_cloud (weighted by total stratiform cloud area),Cloud-Top Effective Droplet Radius in Stratiform Cloud,longitude latitude time,mon,Cloud-Top Effective Droplet Radius in Stratiform Cloud,aerosol,,,m,New,,,,,
Variable aerosol.mon.reffccwctop_tavg-u-hxy-ccl (Emon.reffccwctop),988,https://github.com/UKNCSP/CDDS-CMIP7-mappings/issues/988,mon aerosol,reffccwctop_tavg-u-hxy-ccl,effective_radius_of_cloud_condensed_water_particles_at_cloud_top,Not present,area: areacella,area: time: mean,Cloud-Top Effective Radius of Liquid or Ice Cloud at Liquid or Ice Cloud Top,longitude latitude time,mon,Cloud-Top Effective Radius of Liquid or Ice Cloud at Liquid or Ice Cloud Top,aerosol,,,m,New,,,,,
Variable aerosol.mon.reffcclwtop_tavg-u-hxy-ccl (Emon.reffcclwtop),987,https://github.com/UKNCSP/CDDS-CMIP7-mappings/issues/987,mon aerosol,reffcclwtop_tavg-u-hxy-ccl,effective_radius_of_convective_cloud_liquid_water_particles_at_convective_liquid_water_cloud_top,Not present,area: areacella,area: time: mean where convective_cloud (weighted by total convective cloud area),Cloud-Top Effective Droplet Radius in Convective Cloud,longitude latitude time,mon,Cloud-Top Effective Droplet Radius in Convective Cloud,aerosol,,,m,New,,,,,
Variable aerosol.mon.ccldncl_tavg-u-hxy-ccl (Emon.ccldncl),858,https://github.com/UKNCSP/CDDS-CMIP7-mappings/issues/858,mon aerosol,ccldncl_tavg-u-hxy-ccl,number_concentration_of_convective_cloud_liquid_water_particles_at_convective_liquid_water_cloud_top,Not present,area: areacella,area: time: mean,Cloud Droplet Number Concentration of Convective Cloud Tops,longitude latitude time,mon,Cloud Droplet Number Concentration of Convective Cloud Tops,aerosol,,,m-3,New,,,,,
Variable aerosol.3hr.so2_tavg-u-hm-u (E3hrPt.so2),702,https://github.com/UKNCSP/CDDS-CMIP7-mappings/issues/702,3hr aerosol,so2_tavg-u-hm-u,mole_fraction_of_sulfur_dioxide_in_air,Not present,::MODEL,area: point time: point,"This variable represents the instantaneous surface so2 volume mixing ration at CF sites, sampled every 3 hours",site time1,3hr,Surface SO2 volume mixing ratio at CF sites,aerosol,,,mol mol-1,New,,,,,
Variable aerosol.3hr.mmrss_tpt-u-hm-u (E3hrPt.mmrss),701,https://github.com/UKNCSP/CDDS-CMIP7-mappings/issues/701,3hr aerosol,mmrss_tpt-u-hm-u,mass_fraction_of_sea_salt_dry_aerosol_particles_in_air,Not present,::MODEL,area: point time: point,"This variable represents instantaneous surface sea salt aerosol mass mixing ratio at CF sites, sampled every 3 hours",site time1,3hr,Sea salt Aerosol Mass Mixing Ratio at CF sites,aerosol,,,kg kg-1,New,,,,,
Variable aerosol.3hr.mmrso4_tpt-u-hm-u (E3hrPt.mmrso4),700,https://github.com/UKNCSP/CDDS-CMIP7-mappings/issues/700,3hr aerosol,mmrso4_tpt-u-hm-u,mass_fraction_of_sulfate_dry_aerosol_particles_in_air,Not present,::MODEL,area: point time: point,"This variable is for instantaneous surface mass mixing ratio of sulfate aerosol at CF sites, sampled every 3 hours",site time1,3hr,Instantaneous Aerosol Sulfate Mass Mixing Ratio at CF sites,aerosol,,,kg kg-1,New,,,,,
Variable aerosol.3hr.mmroa_tpt-u-hm-u (E3hrPt.mmroa),699,https://github.com/UKNCSP/CDDS-CMIP7-mappings/issues/699,3hr aerosol,mmroa_tpt-u-hm-u,mass_fraction_of_particulate_organic_matter_dry_aerosol_particles_in_air,Not present,::MODEL,area: point time: point,"This variable represents the instantaneous surface organic aerosol Mass Mixing Ratio at CF sites, sampled every 3 hours.",site time1,3hr,Instantaneous surface total organic aerosol mass mixing ratio at CF sites,aerosol,,,kg kg-1,New,,,,,
Variable aerosol.3hr.mmrno3_tpt-u-hm-u (E3hrPt.mmrno3),698,https://github.com/UKNCSP/CDDS-CMIP7-mappings/issues/698,3hr aerosol,mmrno3_tpt-u-hm-u,mass_fraction_of_nitrate_dry_aerosol_particles_in_air,Not present,::MODEL,area: point time: point,"This variable represents the instantaneous surface NO3 Aerosol Mass Mixing Ratio at CF sites, sampled every 3 hours",site time1,3hr,Instantaneous surface NO3 aerosol mass mixing ratio at CF sites,aerosol,,,kg kg-1,New,,,,,
Variable aerosol.3hr.mmrnh4_tpt-u-hm-u (E3hrPt.mmrnh4),697,https://github.com/UKNCSP/CDDS-CMIP7-mappings/issues/697,3hr aerosol,mmrnh4_tpt-u-hm-u,mass_fraction_of_ammonium_dry_aerosol_particles_in_air,Not present,::MODEL,area: point time: point,"This variable represents the instantaneous surface NH4 Aerosol Mass Mixing Ratio at CF sites, sampled every 3 hours",site time1,3hr,Instantaneous surface NH4 aerosol mass mixing ratio at CF sites,aerosol,,,kg kg-1,New,,,,,
Variable aerosol.3hr.mmrdust_tpt-u-hm-u (E3hrPt.mmrdust),696,https://github.com/UKNCSP/CDDS-CMIP7-mappings/issues/696,3hr aerosol,mmrdust_tpt-u-hm-u,mass_fraction_of_dust_dry_aerosol_particles_in_air,Not present,::MODEL,area: point time: point,"This variable represents the instantaneous surface Dust Aerosol Mass Mixing Ratio at CF sites, sampled every 3 hours",site time1,3hr,Instantaneous surface Dust Aerosol Mass Mixing Ratio at CF sites,aerosol,,,kg kg-1,New,,,,,
Variable aerosol.3hr.mmrbc_tpt-u-hm-u (E3hrPt.mmrbc),695,https://github.com/UKNCSP/CDDS-CMIP7-mappings/issues/695,3hr aerosol,mmrbc_tpt-u-hm-u,mass_fraction_of_elemental_carbon_dry_aerosol_particles_in_air,Not present,::MODEL,area: point time: point,"This variable represents the instantaneous surface elemental carbon Aerosol Mass Mixing Ratio at CF sites, sampled every 3 hours",site time1,3hr,Elemental carbon mass mixing ratio,aerosol,,,kg kg-1,New,,,,,
Variable aerosol.3hr.mmraerh2o_tpt-u-hm-u (E3hrPt.mmraerh2o),694,https://github.com/UKNCSP/CDDS-CMIP7-mappings/issues/694,3hr aerosol,mmraerh2o_tpt-u-hm-u,mass_fraction_of_water_in_ambient_aerosol_particles_in_air,Not present,::MODEL,area: point time: point,"This variable represents the instantaneous surface aerosol water Mass Mixing Ratio at CF sites, sampled every 3 hours",site time1,3hr,Instantaneous surface aerosol water mass mixing ratio at CF sites,aerosol,,,kg kg-1,New,,,,,
Variable aerosol.3hr.conccn_tpt-u-hxys-u (E3hrPt.conccn),691,https://github.com/UKNCSP/CDDS-CMIP7-mappings/issues/691,3hr aerosol,conccn_tpt-u-hxys-u,number_concentration_of_ambient_aerosol_particles_in_air,Not present,::MODEL,area: point time: point,"The variable represents the instantaneous Aerosol Number Concentration at CF sites, sampled every 3 hours",site time1,3hr,Sub-daily Aerosol Number Concentration at CF sites,aerosol,,,m-3,New,,,,,
Variable aerosol.mon.rluscsaf_tavg-u-hxy-u (AERmon.rluscsaf),390,https://github.com/UKNCSP/CDDS-CMIP7-mappings/issues/390,mon aerosol,rluscsaf_tavg-u-hxy-u,surface_upwelling_longwave_flux_in_air_assuming_clear_sky_and_no_aerosol,Not present,area: areacella,area: time: mean,Flux corresponding to rluscs resulting from an aerosol-free call to radiation,longitude latitude time,mon,"Surface Upwelling Clear-Sky, Aerosol-Free Longwave Radiation",aerosol,up,,W m-2,New,,,,,
Variable aerosol.mon.hfc134a_tavg-l-hxy-u (AERmon.hfc134a),338,https://github.com/UKNCSP/CDDS-CMIP7-mappings/issues/338,mon aerosol,hfc134a_tavg-l-hxy-u,mole_fraction_of_hfc134a_in_air,Not present,area: areacella,area: time: mean,This is the mole fraction of HFC134a in air,longitude latitude alevel time,mon,Mole Fraction of HFC134a,aerosol,,,mol mol-1,New,,,,,
Variable aerosol.mon.hfc125_tavg-l-hxy-u (AERmon.hfc125),337,https://github.com/UKNCSP/CDDS-CMIP7-mappings/issues/337,mon aerosol,hfc125_tavg-l-hxy-u,mole_fraction_of_hfc125_in_air,Not present,area: areacella,area: time: mean,This is the mole fraction of HFC125 in air,longitude latitude alevel time,mon,Mole Fraction of HFC125,aerosol,,,mol mol-1,New,,,,,
Variable aerosol.mon.hcfc22_tavg-l-hxy-u (AERmon.hcfc22),334,https://github.com/UKNCSP/CDDS-CMIP7-mappings/issues/334,mon aerosol,hcfc22_tavg-l-hxy-u,mole_fraction_of_hcfc22_in_air,Not present,area: areacella,area: time: mean,This is the mole fraction of HCFC22 in air,longitude latitude alevel time,mon,Mole Fraction of HCFC22,aerosol,,,mol mol-1,New,,,,,
Variable aerosol.mon.emibbvoc_tavg-u-hxy-u (AERmon.emibbvoc),305,https://github.com/UKNCSP/CDDS-CMIP7-mappings/issues/305,mon aerosol,emibbvoc_tavg-u-hxy-u,tendency_of_atmosphere_mass_content_of_nmvoc_due_to_emission_from_fires,Not present,area: areacella,area: time: mean,Total emission rate of non-methane volatile organic compounds (NMVOCs) from all biomass burning (natural and anthropogenic),longitude latitude time,mon,total emission rate of NMVOC from all biomass burning,aerosol,,,kg m-2 s-1,New,,,,,
Variable aerosol.mon.emibbso2_tavg-u-hxy-u (AERmon.emibbso2),304,https://github.com/UKNCSP/CDDS-CMIP7-mappings/issues/304,mon aerosol,emibbso2_tavg-u-hxy-u,tendency_of_atmosphere_mass_content_of_sulfur_dioxide_due_to_emission_from_fires,Not present,area: areacella,area: time: mean,Total emission rate of SO2 into the atmosphere from all biomass burning (natural and anthropogenic).,longitude latitude time,mon,total emission rate of SO2 from all biomass burning,aerosol,,,kg m-2 s-1,New,,,,,
Variable aerosol.mon.emibboa_tavg-u-hxy-u (AERmon.emibboa),303,https://github.com/UKNCSP/CDDS-CMIP7-mappings/issues/303,mon aerosol,emibboa_tavg-u-hxy-u,tendency_of_atmosphere_mass_content_of_particulate_organic_matter_dry_aerosol_particles_due_to_emission_from_fires,Not present,area: areacella,area: time: mean,Total emission rate of particulate organic matter (organic aerosol) into the atmosphere from all biomass burning (natural and anthropogenic),longitude latitude time,mon,total emission of organic aerosol from all biomass burning,aerosol,,,kg m-2 s-1,New,,,,,
Variable aerosol.mon.emibbnox_tavg-u-hxy-u (AERmon.emibbnox),302,https://github.com/UKNCSP/CDDS-CMIP7-mappings/issues/302,mon aerosol,emibbnox_tavg-u-hxy-u,tendency_of_atmosphere_mass_content_of_nox_expressed_as_nitrogen_due_to_emission_from_fires,Not present,area: areacella,area: time: mean,Total emission rate of nitrogen oxides (NOx) from all biomass burning (natural and anthropogenic),longitude latitude time,mon,total emission rate of NOx from all biomass burning,aerosol,,,kg m-2 s-1,New,,,,,
Variable aerosol.mon.emibbnh3_tavg-u-hxy-u (AERmon.emibbnh3),301,https://github.com/UKNCSP/CDDS-CMIP7-mappings/issues/301,mon aerosol,emibbnh3_tavg-u-hxy-u,tendency_of_atmosphere_mass_content_of_ammonia_due_to_emission_from_fires,Not present,area: areacella,area: time: mean,Total emission rate of ammonia (NH3) into the atmosphere from all biomass burning (natural and anthropogenic),longitude latitude time,mon,total emission rate of NH3 from all biomass burning,aerosol,,,kg m-2 s-1,New,,,,,
Variable aerosol.mon.emibbdms_tavg-u-hxy-u (AERmon.emibbdms),300,https://github.com/UKNCSP/CDDS-CMIP7-mappings/issues/300,mon aerosol,emibbdms_tavg-u-hxy-u,tendency_of_atmosphere_mass_content_of_dimethyl_sulfide_due_to_emission_from_fires,Not present,area: areacella,area: time: mean,Total emission rate of dimethyl sulfide (DMS) into the atmosphere from all biomass burning (natural and anthropogenic),longitude latitude time,mon,total emission of DMS from all biomass burning,aerosol,,,kg m-2 s-1,New,,,,,
Variable aerosol.mon.emibbco_tavg-u-hxy-u (AERmon.emibbco),299,https://github.com/UKNCSP/CDDS-CMIP7-mappings/issues/299,mon aerosol,emibbco_tavg-u-hxy-u,tendency_of_atmosphere_mass_content_of_carbon_monoxide_due_to_emission_from_fires,Not present,area: areacella,area: time: mean,Total emission rate of carbon monoxide (CO) into the atmosphere from all biomass burning (natural and anthropogenic),longitude latitude time,mon,total emission rate of CO from all biomass burning,aerosol,,,kg m-2 s-1,New,,,,,
Variable aerosol.mon.emibbch4_tavg-u-hxy-u (AERmon.emibbch4),298,https://github.com/UKNCSP/CDDS-CMIP7-mappings/issues/298,mon aerosol,emibbch4_tavg-u-hxy-u,tendency_of_atmosphere_mass_content_of_methane_due_to_emission_from_fires,Not present,area: areacella,area: time: mean,Total emission rate of methane (CH4) into the atmosphere from all biomass burning (natural and anthropogenic),longitude latitude time,mon,total emission of CH4 from all biomass burning,aerosol,,,kg m-2 s-1,New,,,,,
Variable aerosol.mon.emibbbc_tavg-u-hxy-u (AERmon.emibbbc),297,https://github.com/UKNCSP/CDDS-CMIP7-mappings/issues/297,mon aerosol,emibbbc_tavg-u-hxy-u,tendency_of_atmosphere_mass_content_of_elemental_carbon_dry_aerosol_particles_due_to_emission_from_fires,Not present,area: areacella,area: time: mean,Total emission rate of black carbon aerosol into the atmosphere from all biomass burning (natural and anthropogenic),longitude latitude time,mon,total emission rate of black carbon aerosol mass from all biomass burning,aerosol,,Vertical integral,kg m-2 s-1,New,,,,,
Variable aerosol.mon.dryno3_tavg-u-hxy-u (AERmon.dryno3),284,https://github.com/UKNCSP/CDDS-CMIP7-mappings/issues/284,mon aerosol,dryno3_tavg-u-hxy-u,tendency_of_atmosphere_mass_content_of_nitrate_dry_aerosol_due_to_dry_deposition,Not present,area: areacella,area: time: mean,Loss rate of nitrate (NO3) aerosol from the atmosphere due to dry deposition,longitude latitude time,mon,dry deposition of NO3 aerosol,aerosol,,,kg m-2 s-1,New,,,,,
Variable aerosol.mon.conccn_tavg-l-hxy-u (AERmon.conccn),275,https://github.com/UKNCSP/CDDS-CMIP7-mappings/issues/275,mon aerosol,conccn_tavg-l-hxy-u,number_concentration_of_ambient_aerosol_particles_in_air,Not present,area: areacella,area: time: mean,This is the number concentration of air particles in air,longitude latitude alevel time,mon,Aerosol Number Concentration,aerosol,,,m-3,New,,,,,
Variable aerosol.mon.cfc114_tavg-l-hxy-u (AERmon.cfc114),259,https://github.com/UKNCSP/CDDS-CMIP7-mappings/issues/259,mon aerosol,cfc114_tavg-l-hxy-u,mole_fraction_of_cfc114_in_air,Not present,area: areacella,area: time: mean,Mole fraction of cfc114 in air,longitude latitude alevel time,mon,Mole Fraction of CFC114,aerosol,,,mol mol-1,New,,,,,
Variable aerosol.mon.ccn1_tavg-l-hxy-u (AERmon.ccn1),257,https://github.com/UKNCSP/CDDS-CMIP7-mappings/issues/257,mon aerosol,ccn1_tavg-l-hxy-u,number_concentration_of_cloud_condensation_nuclei_assuming_reference_relative_humidity,Not present,area: areacella,area: time: mean,"This is the concentration of cloud condensation nuclei (CCN) at 1.0 percent supersaturation, based on aerosol chemical composition and size",longitude latitude alevel time rh101pct,mon,CCN concentration at 1.0 percent supersaturation,aerosol,,,m-3,New,,,,,
Variable aerosol.mon.ccn02_tavg-l-hxy-u (AERmon.ccn02),256,https://github.com/UKNCSP/CDDS-CMIP7-mappings/issues/256,mon aerosol,ccn02_tavg-l-hxy-u,number_concentration_of_cloud_condensation_nuclei_assuming_reference_relative_humidity,Not present,area: areacella,area: time: mean,"This is the concentration of cloud condensation nuclei (CCN) at 0.2% supersaturation, based on aerosol chemical composition and size",longitude latitude alevel time rh100p2pct,mon,CCN concentration at 0.2 percent supersaturation,aerosol,,,m-3,New,,,,,
Variable aerosol.mon.abs550ss_tavg-u-hxy-u (AERmon.abs550ss),245,https://github.com/UKNCSP/CDDS-CMIP7-mappings/issues/245,mon aerosol,abs550ss_tavg-u-hxy-u,atmosphere_absorption_optical_thickness_due_to_sea_salt_ambient_aerosol_particles,Not present,area: areacella,area: time: mean,This is the sea salt aerosol optical depth at 550nm due to absorption,longitude latitude time lambda550nm,mon,sea salt aaod@550nm,aerosol,,,1,New,,,,,
Variable aerosol.mon.abs550so4_tavg-u-hxy-u (AERmon.abs550so4),244,https://github.com/UKNCSP/CDDS-CMIP7-mappings/issues/244,mon aerosol,abs550so4_tavg-u-hxy-u,atmosphere_absorption_optical_thickness_due_to_sulfate_ambient_aerosol_particles,Not present,area: areacella,area: time: mean,This is the sulphate aerosol optical depth at 550nm due to absorption,longitude latitude time lambda550nm,mon,sulfate aaod@550nm,aerosol,,,1,New,,,,,
Variable aerosol.mon.abs550oa_tavg-u-hxy-u (AERmon.abs550oa),243,https://github.com/UKNCSP/CDDS-CMIP7-mappings/issues/243,mon aerosol,abs550oa_tavg-u-hxy-u,atmosphere_absorption_optical_thickness_due_to_particulate_organic_matter_ambient_aerosol_particles,Not present,area: areacella,area: time: mean,This is the particular organic matter aerosol optical depth at 550nm due to absorption,longitude latitude time lambda550nm,mon,particulate organic matter aaod@550nm,aerosol,,,1,New,,,,,
Variable aerosol.mon.abs550no3_tavg-u-hxy-u (AERmon.abs550no3),242,https://github.com/UKNCSP/CDDS-CMIP7-mappings/issues/242,mon aerosol,abs550no3_tavg-u-hxy-u,atmosphere_absorption_optical_thickness_due_to_nitrate_ambient_aerosol_particles,Not present,area: areacella,area: time: mean,This is the nitrate aerosol optical depth at 550nm due to absorption,longitude latitude time lambda550nm,mon,nitrate aaod@550nm,aerosol,,,1,New,,,,,
Variable aerosol.mon.abs550dust_tavg-u-hxy-u (AERmon.abs550dust),241,https://github.com/UKNCSP/CDDS-CMIP7-mappings/issues/241,mon aerosol,abs550dust_tavg-u-hxy-u,atmosphere_absorption_optical_thickness_due_to_dust_ambient_aerosol_particles,Not present,area: areacella,area: time: mean,This is the dust aerosol optical depth at 550nm due to absorption,longitude latitude time lambda550nm,mon,dust absorption aerosol optical depth @550nm,aerosol,,,1,New,,,,,
Variable aerosol.mon.abs550bc_tavg-u-hxy-u (AERmon.abs550bc),240,https://github.com/UKNCSP/CDDS-CMIP7-mappings/issues/240,mon aerosol,abs550bc_tavg-u-hxy-u,atmosphere_absorption_optical_thickness_due_to_black_carbon_ambient_aerosol,Not present,area: areacella,area: time: mean,This is the black carbon aerosol optical depth at 550nm due to absorption,longitude latitude time lambda550nm,mon,black carbon aaod@550nm,aerosol,,,1,New,,,,,
Variable aerosol.1hr.sfpm10_tavg-u-hm-u (AERhr.sfpm10),236,https://github.com/UKNCSP/CDDS-CMIP7-mappings/issues/236,1hr aerosol,sfpm10_tavg-u-hm-u,mass_fraction_of_pm10_ambient_aerosol_particles_in_air,Not present,area: areacella,area: time: mean,Hourly PM10 Mass Mixing Ratio in Lowest Model Layer,longitude latitude time,1hr,Hourly Surface PM10 Mixing Ratio,aerosol,,,kg kg-1,New,,,,,
Variable aerosol.1hr.sfpm1_tavg-u-hm-u (AERhr.sfpm1),235,https://github.com/UKNCSP/CDDS-CMIP7-mappings/issues/235,1hr aerosol,sfpm1_tavg-u-hm-u,mass_fraction_of_pm1_ambient_aerosol_particles_in_air,Not present,area: areacella,area: time: mean,Hourly PM1.0 Mass Mixing Ratio in Lowest Model Layer,longitude latitude time,1hr,Hourly Surface PM1.0 Mixing Ratio,aerosol,,,kg kg-1,New,,,,,
Variable aerosol.mon.o3ref_tavg-l-hxy-u (AERfx.o3refClim),231,https://github.com/UKNCSP/CDDS-CMIP7-mappings/issues/231,mon aerosol,o3ref_tavg-l-hxy-u,reference_mole_fraction_of_ozone_in_air,Not present,area: areacella,area: time: mean (monthly mean fixed annual cycle),This is the ozone mole fraction that is used in a diagnostic call to the model's radiation scheme. It is only applicable when an ozone double call is active in the model.,longitude latitude alevel timefxc,mon,Fixed Reference Climatology of Mole Fraction of Ozone in Air,aerosol,,Use this when o3ref has a repeating climatological cycle.,mol mol-1,New,,,,,
Variable aerosol.day.so2_tavg-u-hm-u (AERday.so2),220,https://github.com/UKNCSP/CDDS-CMIP7-mappings/issues/220,day aerosol,so2_tavg-u-hm-u,mole_fraction_of_sulfur_dioxide_in_air,Not present,area: areacella,area: time: mean,Daily mean SO2 volume mixing ratio in lowest model layer,longitude latitude time,day,Surface daily mean SO2,aerosol,,,mol mol-1,New,,,,,
Variable aerosol.day.sfpm25_tavg-u-hm-u (AERday.sfpm25),219,https://github.com/UKNCSP/CDDS-CMIP7-mappings/issues/219,day aerosol,sfpm25_tavg-u-hm-u,mass_fraction_of_pm2p5_ambient_aerosol_particles_in_air,Not present,area: areacella,area: time: mean,Daily mean PM2.5 mass mixing ratio in lowest model layer,longitude latitude time,day,Daily mean surface PM2.5,aerosol,,,kg kg-1,New,,,,,
Variable aerosol.day.sfpm10_tavg-u-hm-u (AERday.sfpm10),218,https://github.com/UKNCSP/CDDS-CMIP7-mappings/issues/218,day aerosol,sfpm10_tavg-u-hm-u,mass_fraction_of_pm10_ambient_aerosol_particles_in_air,Not present,area: areacella,area: time: mean,Daily mean PM10 mass mixing ratio in lowest model layer,longitude latitude time,day,Daily mean surface PM10,aerosol,,,kg kg-1,New,,,,,
Variable aerosol.day.sfpm1_tavg-u-hm-u (AERday.sfpm1),217,https://github.com/UKNCSP/CDDS-CMIP7-mappings/issues/217,day aerosol,sfpm1_tavg-u-hm-u,mass_fraction_of_pm1_ambient_aerosol_particles_in_air,Not present,area: areacella,area: time: mean,Daily mean PM1.0 mass mixing ratio in lowest model layer,longitude latitude time,day,Surface daily mean PM1.0,aerosol,,,kg kg-1,New,,,,,
Variable aerosol.day.mmrss_tavg-u-hm-u (AERday.mmrss),214,https://github.com/UKNCSP/CDDS-CMIP7-mappings/issues/214,day aerosol,mmrss_tavg-u-hm-u,mass_fraction_of_sea_salt_dry_aerosol_particles_in_air,Not present,area: areacella,area: time: mean,Daily mean Sea Salt mass mixing ratio in lowest model layer,longitude latitude time,day,Daily mean surface Sea Salt,aerosol,,,kg kg-1,New,,,,,
Variable aerosol.day.mmrsoa_tavg-u-hm-u (AERday.mmrsoa),213,https://github.com/UKNCSP/CDDS-CMIP7-mappings/issues/213,day aerosol,mmrsoa_tavg-u-hm-u,mass_fraction_of_secondary_particulate_organic_matter_dry_aerosol_particles_in_air,Not present,area: areacella,area: time: mean,Daily mean secondary organic aerosol mass mixing ratio in lowest model layer,longitude latitude time,day,Daily mean surface SOA,aerosol,,,kg kg-1,New,,,,,
Variable aerosol.day.mmrso4_tavg-u-hm-u (AERday.mmrso4),212,https://github.com/UKNCSP/CDDS-CMIP7-mappings/issues/212,day aerosol,mmrso4_tavg-u-hm-u,mass_fraction_of_sulfate_dry_aerosol_particles_in_air,Not present,area: areacella,area: time: mean,Daily mean sulfate aerosol mass mixing ratio in lowest model layer,longitude latitude time,day,Daily mean surface sulfate aerosol,aerosol,,,kg kg-1,New,,,,,
Variable aerosol.day.mmroa_tavg-u-hm-u (AERday.mmroa),211,https://github.com/UKNCSP/CDDS-CMIP7-mappings/issues/211,day aerosol,mmroa_tavg-u-hm-u,mass_fraction_of_particulate_organic_matter_dry_aerosol_particles_in_air,Not present,area: areacella,area: time: mean,Daily mean total organic aerosol mass mixing ratio in lowest model layer,longitude latitude time,day,Total surface organic aerosol,aerosol,,,kg kg-1,New,,,,,
Variable aerosol.day.mmrno3_tavg-u-hm-u (AERday.mmrno3),210,https://github.com/UKNCSP/CDDS-CMIP7-mappings/issues/210,day aerosol,mmrno3_tavg-u-hm-u,mass_fraction_of_nitrate_dry_aerosol_particles_in_air,Not present,area: areacella,area: time: mean,Daily mean NO3 aerosol mass mixing ratio in lowest model layer,longitude latitude time,day,Daily mean surface NO3 aerosol,aerosol,,,kg kg-1,New,,,,,
Variable aerosol.day.mmrnh4_tavg-u-hm-u (AERday.mmrnh4),209,https://github.com/UKNCSP/CDDS-CMIP7-mappings/issues/209,day aerosol,mmrnh4_tavg-u-hm-u,mass_fraction_of_ammonium_dry_aerosol_particles_in_air,Not present,area: areacella,area: time: mean,Daily mean NH4 mass mixing ratio in lowest model layer,longitude latitude time,day,Daily mean surface NH4,aerosol,,,kg kg-1,New,,,,,
Variable aerosol.day.mmrdust_tavg-u-hm-u (AERday.mmrdust),208,https://github.com/UKNCSP/CDDS-CMIP7-mappings/issues/208,day aerosol,mmrdust_tavg-u-hm-u,mass_fraction_of_dust_dry_aerosol_particles_in_air,Not present,area: areacella,area: time: mean,Daily mean dust aerosol mass mixing ratio in lowest model layer,longitude latitude time,day,Daily mean surface dust aerosol,aerosol,,,kg kg-1,New,,,,,
Variable aerosol.day.mmrbc_tavg-u-hm-u (AERday.mmrbc),207,https://github.com/UKNCSP/CDDS-CMIP7-mappings/issues/207,day aerosol,mmrbc_tavg-u-hm-u,mass_fraction_of_elemental_carbon_dry_aerosol_particles_in_air,Not present,area: areacella,area: time: mean,Daily mean elemental carbon mass mixing ratio in lowest model layer,longitude latitude time,day,Daily mean surface BC,aerosol,,,kg kg-1,New,,,,,
Variable aerosol.day.mmraerh2o_tavg-u-hm-u (AERday.mmraerh2o),206,https://github.com/UKNCSP/CDDS-CMIP7-mappings/issues/206,day aerosol,mmraerh2o_tavg-u-hm-u,mass_fraction_of_water_in_ambient_aerosol_particles_in_air,Not present,area: areacella,area: time: mean,Daily mean Aerosol water mass mixing ratio in lowest model layer,longitude latitude time,day,Daily mean surface Aerosol water mass mixing ratio in lowest model layer,aerosol,,,kg kg-1,New,,,,,
Variable aerosol.day.co_tavg-u-hm-u (AERday.co),199,https://github.com/UKNCSP/CDDS-CMIP7-mappings/issues/199,day aerosol,co_tavg-u-hm-u,mole_fraction_of_carbon_monoxide_in_air,Not present,area: areacella,area: time: mean,This is the daily mean for CO volume mixing ratio in lowest model layer,longitude latitude time,day,Daily mean surface CO,aerosol,,,mol mol-1,New,,,,,
